{
  "protocol": "coworld-improvement-v1",
  "request_id": "cc72d0e5b9c8f575c5f8720b302e1ca417364973712460c38c1fcb64647aaaa1",
  "binary_sha256": "b125d632e9a93b375f095e1bd1e5bc31df996f9615d87bdb803adf411d75d9a9",
  "declared_phase_revision": "54227f4527a0b45b01eb3f819d262ee49b665810",
  "outcome": {
    "kind": "completed",
    "observation": {
      "life": [
        20,
        22
      ],
      "objects": [
        {
          "object_id": 1,
          "name": "Lightning Helix",
          "owner": "player",
          "zone": "graveyard",
          "tapped": false,
          "plus_one_counters": 0,
          "prepared": false,
          "cast_spell_offered_to": []
        },
        {
          "object_id": 2,
          "name": "Grizzly Bears",
          "owner": "opponent",
          "zone": "exile",
          "tapped": false,
          "plus_one_counters": 0,
          "prepared": false,
          "cast_spell_offered_to": []
        },
        {
          "object_id": 3,
          "name": "Swords to Plowshares",
          "owner": "opponent",
          "zone": "graveyard",
          "tapped": false,
          "plus_one_counters": 0,
          "prepared": false,
          "cast_spell_offered_to": []
        },
        {
          "object_id": 4,
          "name": "Forest",
          "owner": "player",
          "zone": "battlefield",
          "tapped": false,
          "plus_one_counters": 0,
          "prepared": false,
          "cast_spell_offered_to": []
        }
      ],
      "labels": {
        "bear": 2,
        "helix": 1,
        "irrelevant-land": 4,
        "swords": 3
      }
    },
    "steps": [
      {
        "operation_index": 0,
        "state_sha256": "9dc8a5b079107ecc256322bd6029ee988bdd90f8dda858d371aa63ec38a192dc"
      },
      {
        "operation_index": 1,
        "state_sha256": "11b18025ddcbe88bdf5c534e2eeb2a0987584a187d75131df48862b83935ae63"
      },
      {
        "operation_index": 2,
        "state_sha256": "92ca8457ddc18d40db2fe48a33a30006e79c38aecf3c4a2d67090bc812db1bb8"
      },
      {
        "operation_index": 3,
        "state_sha256": "92ca8457ddc18d40db2fe48a33a30006e79c38aecf3c4a2d67090bc812db1bb8"
      }
    ]
  }
}
