{
  "protocol": "coworld-improvement-v1",
  "request_id": "dfe510250b16f92eb1f2b55c6fe592230978bb0430f21ea808f872d3e14fe78a",
  "binary_sha256": "e4e8cb9d6024592745a0da533bcd86001c8115184a1ddcf0163c1f3f04494d98",
  "declared_phase_revision": "2dec6c88915db4697706234a7ba2fcedd97b1689",
  "outcome": {
    "kind": "completed",
    "observation": {
      "life": [
        20,
        20
      ],
      "objects": [
        {
          "object_id": 1,
          "name": "Rancor",
          "owner": "player",
          "zone": "graveyard",
          "tapped": false,
          "plus_one_counters": 0,
          "prepared": false,
          "cast_spell_offered_to": []
        },
        {
          "object_id": 2,
          "name": "Grizzly Bears",
          "owner": "player",
          "zone": "graveyard",
          "tapped": false,
          "plus_one_counters": 0,
          "prepared": false,
          "cast_spell_offered_to": []
        },
        {
          "object_id": 3,
          "name": "Doom Blade",
          "owner": "opponent",
          "zone": "graveyard",
          "tapped": false,
          "plus_one_counters": 0,
          "prepared": false,
          "cast_spell_offered_to": []
        }
      ],
      "labels": {
        "bear": 2,
        "doom": 3,
        "rancor": 1
      }
    },
    "steps": [
      {
        "operation_index": 0,
        "state_sha256": "967899929b8ae28dd9f7083545e5c9d84384b7aac7b5b9824c23972830158d56"
      },
      {
        "operation_index": 1,
        "state_sha256": "4777fdc351294ecf50649e35928a9b0eb98aa577f693e941cd2b5cf7f6f0c9ef"
      },
      {
        "operation_index": 2,
        "state_sha256": "5b546a59aeee78d7dd171771a97e857f767ae49327aef4c180b8fde159536108"
      },
      {
        "operation_index": 3,
        "state_sha256": "5b546a59aeee78d7dd171771a97e857f767ae49327aef4c180b8fde159536108"
      }
    ]
  }
}
